,poet_name,poem_name,poem_content
256,صفي الدين الحلي,كان الزمان بلقياكم يمنينا,"
كانَ الزَمانُ بِلُقياكُم يُمَنّينا
وَحادِثُ الدَهرِ بِالتَفريقِ يَثنينا
فَعِندَما صَدَقَت فيكُم أَمانينا
أَضحى التَنائي بَديلاً مِن تَدانينا
وَنابَ عَن طيبِ لُقيانا تَجافينا
خِلنا الزَمانِ بِلُقياكُم يُسامِحُنا
لِكَي تُزانَ بِذِكراكُم مَدائِحُنا
فَعِندَما سَمَحَت فيكُم قَرائِحُنا
بِنتُم وَبِنّا فَما اِبتَلَّت جَوانِحُنا
شَوقاً إِلَيكُم وَلا جَفَّت مَآقينا
لَم يُرضِنا أَن دَعا بِالبَينِ طائِرُنا
شَقُّ الجُيوبِ وَما شُقَّت مَرائِرُنا
يا غائِبينَ وَمَأواهُم سَرائِرُنا
تَكادُ حينَ تُناجيكُم ضَمائِرُنا
يَقضي عَلينا الأَسى لَولا تَأَسّينا
حَمَدتُ أَيّامَ أُنسٍ لي بِكُم سَعِدَت
وَأَسعَدَت إِذ وَفَت فيكُم بِما وَعَدَت
فَاليَومَ إِذ غِبتُمُ وَالدارُ قَد بَعُدَت
حالَت لِفَقدِكُمُ أَيّامُنا فَغَدَت
سوداً وَكانَت بِكُم بيضاً لَيالينا
فُزنا بِنَيلِ الأَماني مِن تَشَرُّفِنا
بِقُربِكُم إِذ بُرينا مِن تَكَلُّفِنا
حَتّى كَأَنَّ اللَيالي في تَصَرُّفِنا
إِذ جانِبُ العَيشِ طَلقٌ مِن تَأَلُّفِنا
وَمَورِدُ اللَهوِ صافٍ مِن تَصافينا
كَم قَد وَرَدنا مِياهُ العِزِّ صافِيَةً
وَكَم عَلَلنا بِها الأَرواحَ ثانِيَةً
إِذ عَينُها لَم تَكُن بِالمَنِّ آنِيَةً
وَإِذ هَصَرنا غُصونَ الأُنسِ دانِيَةً
قُطوفُها فَجَنَينا مِنهُ ما شينا
يا سادَةً كانَ مَغناهُم لَنا حَرَما
وَكانَ رَبعُ حَماةٍ لِلنَزيلِ حِمى
كَم قَد سَقَيتُم مِياهَ الجودِ رَبُّ ظَما
لِيَسقِ عَهدَكُمُ عَهدُ الغَمامِ فَما
كُنتُم لِأَرواحِنا إِلّا رَياحينا
هَل يَعلَمُ المُسكِرونا مِن سَماحِهِمُ
بِرَشفِ راحِ النَدى مِن كاسِ راحِهِمُ
أَنّا لَبِسنا الضَنا بَعدَ اِلتِماحِهِمُ
مَن مُبلِغُ المُلبِسينا بِاِنتِزاحِهِمُ
ثَوباً مِنَ الحُزنِ لا يَبلى وَيُبلينا
إِذا ذَكَرنا زَماناً كانَ يُدرِكُنا
بِالقُربِ مِنكُم وَفي اللَذّاتِ يُشرِكُنا
لا نَملِكُ الدَمعَ وَالأَحزانُ تَملِكُنا
إِنَّ الزَمانَ الَّذي قَد كانَ يُضحِكُنا
آناً بِقُربِكُمُ قَد صارَ يُبكينا
نَعى المُؤَيَّدَ قَومٌ لَو دَرَوا وَوَعوا
أَيَّ المُلوكِ إِلى أَيَّ الكِرامِ نَعوا
أَظُنُّهُ إِذ سَقانا الوُدَّ حينَ سَعوا
غَيظَ العِدى مِن تَساقينا الهَوى فَدَعوا
بِأَن نَغَصَّ فَقالَ الدَهرُ آمينا
لَمّا رَأوا ما قَضينا مِن مَجالِسِنا
وَسِبطَ أُنسٍ رَأَينا مِن مَجالِسِنا
دَعَوا لِنُفجَعَ في الدُنيا بِأَنفُسِنا
فَاِنحَلَّ ما كانَ مَعقوداً بِأَنفُسِنا
وَاَنبَتَّ ما كانَ مَوصُلاً بِأَيدينا
أَينَ الَّذينَ عَهِدنا الجودَ يوثِقُنا
في رَبعِهِم وَلَهُم بِالشُكرِ يُنطِقُنا
وَكانَ فيهِم بِهِم مِنهُم تَأَنُّقُنا
وَقَد نَكونُ وَما يُخشى تَفَرُّقُنا
فَاليَومَ نَحنُ وَما يُرجى تَلاقينا
يا غائِبينَ وَلا تَخلو خَواطِرُنا
مِن شَخصِهِم وَإِنِ اِشتاقَت نَواظِرُنا
وَاللَهِ لا يَنقَضي فيكُم تَفَكُّرُنا
لا تَحسَبوا نَأيَكُم عَنّا يُغَيِّرُنا
إِن طالَ ما غَيَّرَ النائي المُحِبّينا
إِنّا وَإِن زادَنا تَفريقُنا غُلَلاً
إِلى اللِقا وَكَسانا بَعدَكُم عِلَلاً
لَم نَدعُ غَيرَكُمُ سُؤلاً وَلا أَمَلاً
وَاللَهِ ما طَلَبَت أَرواحُنا بَدَلاً
مِنكُم وَلا اِنصَرَفَت عَنكُم أَمانينا
إِذا ذَكَرتُ حِمى العاصي وَمَلعَبِهِ
وَالقَصرَ وَالقُبَّةَ العُليا بِمَرقَبِهِ
أَقولُ وَالبَرقُ سارٍ في تَلَهُّبِهِ
يا سارِيَ البَرقِ غادي القَصرَ فَاِسقِ بِهِ
مَن كانَ صَرفَ الهَوى وَالوُدَّ يَسقينا
يا غادِيَ المُزنِ إِن وافَيتَ حِلَّتَنا
عَلى حَماةَ فَجُد فيها مَحَلَّتَنا
وَاِقرَ السَلامَ بِها عَنّا أَحِبَّتَنا
وَيا نَسيمَ الصَبا بَلِّغ تَحِيَّتَنا
مَن لَو عَلى البُعدِ مُتنا كانَ يُحيينا
سُلطانُ عَصرٍ إِلَهُ العَرشِ بَوَّأَهُ
مِنَ المَعالي وَلِلخَيراتِ هَيَّأَهُ
بَراهُ زَيناً وَمِمّا شانَ بَرَّأَهُ
رَبيبُ مُلكٍ كَأَنَّ اللَهَ أَنشَأَهُ
مِسكاً وَقَدَّرَ إِنشاءَ الوَرى طَينا
نَحنُ الفِداءُ لِمَن أَبقى لَنا خَلَفاً
مِن ذِكرِهِ وَإِنِ اِزدَدنا بِهِ أَسَفاً
وَإِن نَكُن دونَ أَن يُفدى بِنا أُنُفاً
ما ضَرَّ إِن لَم نَكُن أَكفاءَهُ شَرَفاً
وَفي المَوَدَّةِ كافٍ مِن تَكافينا
يا مَن يَرى مَغنَمَ الأَموالِ مَغرَمَةً
إِن لَم يُفِد طالِبي جَدواهُ مَكرُمَةً
إِنّا وَإِن حُزتَ أَلقاباً مَكَرَّمَةً
لَسنا نُسَمّيكَ إِجلالاً وَتَكرِمَةً
وَقَدرُكَ المُعتَلي عَن ذاكَ يُغنينا
كَم قَد وُصِفتَ بِأَوصافٍ مُشَرِّفَةٍ
في خَطِّ ذي قَلَمٍ أَو نُطقِ ذي شَفَةٍ
فَقَد عَرَفناكَ مِنها أَيَّ مَعرِفَةٍ
إِذا اِنفَرَدتَ وَما شورِكتَ في صِفَةٍ
فَحَسبُنا الوَصفُ إيضاحاً وَتَبيينا
خَلَّفتَ بَعدَكَ لِلدُنيا وَآمِلِها
نُجلاً يُسَرُّ البَرايا في تَأَمُّلِها
فَلَم تَقُل عَنكَ نَفسٌ في تَمَلمُلِها
ياجَنَّةَ الخُلدِ أَبدِلنا بِسِلسَلِها
وَالكَوثَرِ العَذبِ زُقوماً وَغِسلينا
كَم خَلوَةٍ هَزَّنا لِلبَحثِ باعِثُنا
فَلَيسَ يُؤنِسُنا إِلّا مَباحِثُنا
فَاليَومَ أُخرِسَ بِالتَفريقِ نافِثُنا
كَأَنَّنا لَم نَبِت وَالوَصلُ ثالِثُنا
وَالدَهرُ قَد غَضَّ مِن أَجفانِ واشينا
وَلَيلَةٍ قَد حَلا فيها تَنادُمُنا
وَالعِزُّ يَكنِفُنا وَالسَعدُ يَقدُمُنا
وَنَحنُ في خَلوَةٍ وَالدَهرُ يَخدُمُنا
سِرّينَ في خاطِرِ الظَلماءِ يَكتُمُنا
حَتّى يَكادُ لِسانُ الصُبحِ يُفشينا
لِلَّهِ كَم قَد قَضَينا مِنكُمُ وَطَراً
قَد كانَ عَيناً فَأَمسى بِعدَكُم خَبَراً
لا تَعجَبوا إِن جَعَلنا ذِكرَكُم سَمَراً
إِنّا قَرَأنا الأَسى يَومَ النَوى سُوَرا
مَتلُوَّةً وَاِتَّخَذنا الصَبرَ تَلقينا
كَم مِن حَبيبٍ عَدَلنا مَع تَرَحُّلِهِ
إِلى سِواهُ فَأَغنى عَن تَأَمُّلِهِ
وَصَعبِ وِردٍ عَدَلناهُ بِأَسهَلِهِ
أَمّا هَواكَ فَلَم يُعدَل بِمَنهَلِهِ
شُرباً وَإِن كانَ يَروينا فَيُظمينا
تَشكو إِلى اللَهِ نَفسٌ بَعضَ ما لَقِيَت
غِبَّ النَعيمِ الَّذي مِن بَعدِهِ شَقِيَت
فَيا سَحاباً بِهِ كُلُّ الوَرى سُقِيَت
عَليكَ مِنّي سَلامُ اللَهِ ما بَقِيَت
صَبابَةٌ مِنكَ تُخفيها وَتُخفينا
"
257,صفي الدين الحلي,بكيت دما لو كان سكب الدما يغني,"
بَكَيتُ دَماً لَو كانَ سَكبُ الدِما يُغني
وَضاعَفتُ حُزني لَو شَفى كَمَداً حُزني
وَأَعرَضتُ عَن طيبِ الهَناءِ لِأَنَّني
نَقِمتُ الرِضى حَتّى عَلى ضاحِكِ المُزنِ
أَرى العَيشَ في الدُنيا كَأَحلامِ نائِمٍ
فَلَذّاتُها تَفنى وَأَحداثُها تُفني
فَمِن حادِثٍ جَمٍّ صَفَقتُ لَهُ يَدي
وَمِن فادِحٍ صَعبٍ قَرَعتُ لَهُ سِنّي
أَفي السِتِّ وَالعِشرِينَ أَفقُدُ سِتَّةً
جِبالاً غَدَت مِن عاصِفِ المَوتِ كَالعِهنِ
فَقَدتُ اِبنَ عَمّي وَاِبنِ عَمّي وَصاحِبي
وَأَكبَرَ غِلماني بِها وَأَخي وَاِبني
مَتى تُخلِفُ الأَيّامُ كَاِبنِ مُحَمَّدٍ
وَنَجلِ سَرايا بَعدَهُ وَفَتى الرُكنِ
رِجالاً لَوَ اَنَّ الشامِخاتِ تَساقَطَت
عَلَيهِم لَكانَ القَلبُ مِن ذاكَ في أَمنِ
فُجِعتُ بِنَدبٍ كانَ يَملَأُ ناظِري
فَأَصبَحَ ناعي نَدبِهِ مالِئاً أُذني
عَفيفُ نَواحي الصَدرِ مِن طَيِّ ريبَةٍ
سَليمُ ضَميرِ القَلبِ مِن دَنَسِ الضَغنِ
قَريبٌ إِلى المَعروفِ وَالخَيرِ وَالتُقى
بَعيدٌ عَنِ الفَحشاءِ وَالإِفكِ وَالأَفنِ
جَبانٌ عَنِ الفَحشا شَحيحٌ بِعِرضِهِ
إِذا عَيبَ بَعضُ الناسِ بِالشُحِّ وَالجُبنِ
وَمَن أَتعَبَ اللُوّامَ في بَذلِ بِرِّهِ
فَلائِمُهُ يَثني وَآمِلُهُ يُثني
مَضى طاهِرَ الأَثوابِ وَالنَفسِ وَالخُطى
عَفيفَ مَناطِ الذَيلِ وَالجَيبِ وَالرَدنِ
وَلَم يَبقَ مِن تَذكارِهِ غَيرُ زَفرَةٍ
تُفَرِّقُ بَينَ النَومِ في اللَيلِ وَالجَفنِ
وَلَو سَلَبَتهُ الحَربُ مِنّي لَشاهَدَت
كَما شاهَدَت في ثارِ أَخوالِهِ مِنّي
وَأَبكَيتُ أَجفانَ الصَوارِمِ وَالقَنا
نَجيعاً غَداةَ الكَرِّ في الضَربِ وَالطَعنِ
فَيا اِبنَ أَبي وَالأُمِّ قَد كُنتَ لي أَباً
حُنوّاً وَلَكِن في الإِطاعَةِ لي كَاِبني
لِيَهنِكَ إِنَّ الدَمعَ بَعدَكَ مُطلَقٌ
لَفَرطِ الأَسى وَالقَلبَ بِالهَمِّ في سِجنِ
جَعَلتُ جِبالَ الصَبرِ بِالحُزنِ صَفصَفاً
وَصَيَّرتُ أَطوادَ التَجَلُّدِ كَالعِهنِ
وَحاوَلتُ نَظمَ الشِعرِ فيكَ مَراثِياً
فَأُرتِجَ هَتّى كِدتُ أُخطىءُ في الوَزنِ
بَنَيتُ عَلى أَن أَتَّقِ بِكَ شِدَّتي
وَلَم أَدرِ أَنَّ الدَهرَ يَنقَضُ ما أَبني
وَبُلَّغتُ ما أَمَّلتُ فيكَ سِوى البَقا
وَما رُمتُهُ إِلّا الوُقوفَ عَلى الدَفنِ
سَبَقتَ إِلى الزُلفى وَما مِن مَزيَّةٍ
مِنَ المَجدِ حَتّى كِدتَ عَنهِ لَنا تُغني
خَلَفتَ أَباكَ النَدبَ في كُلِّ خِلَّةٍ
مِنَ المَجدِ حَتّى كِدتَ عَنهُ لَنا تُغني
سَرايا خِصالٍ مِن سَرايا وَرِثتَها
عَلى أَنَّ هَذا الوَردَ مِن ذَلِكَ الغُصنِ
جَزاكَ الَّذي يَمَّمتَ سَعياً لِبَيتِهِ
وَلَبَّيتَ فيهِ مُحرِماً جَنَّتَي عَدنِ
وَوَفّاكَ مَن لَم تَنسَ في الدَهرِ ذِكرَه
شَفاعَتَهُ وَالناسُ في الحَشرِ كَاللُكنِ
فَقَد كُنتَ تُحيي اللَيلَ بِالذِكرِ ضارِعاً
إِلى اللَهِ حَتّى صِرتَ بِالنُسكِ كَالشَنِّ
فَيُؤنِسُني تَرتيبُ نَفلِكَ في الضُحى
وَيُطرِبُني تَرتيلُ وِردِكَ في الوَهنِ
أَمِنتُ صُروفَ الدَهرِ بَعدَكَ وَالأَذى
فَمَن ذا رَأى مِن صارَ بِالخوفِ في أَمنٍ
سَأَبكيكَ بِالعِزِّ الَّذي كُنتَ مُلبِسي
لَديكَ وَثِقلٍ كُنتَ تَحمِلُهُ عَنّي
وَأَعلَمُ أَنَّ الحُزنَ وَالمَوتَ واحِدٌ
عَلَيَّ فَذا يُضني القُلوبَ وَذا يُفني
فَإِن كانَ عُمرُ البَينِ قَد طالَ بَينَنا
كَما طالَ في آناءِ مُدَّتِهِ حُزني
فَحُبُّكَ في قَلبي وَذِكرُكَ في فَمي
وَشَخصُكَ في عَيني وَلَفظُكَ في أُذني
"
258,صفي الدين الحلي,لا عبد يغني عنه ولا ولد,"
لا عَبدَ يُغني عَنهُ وَلا وَلَدُ
ما كُلُّ عَبدٍ عَلَيهِ يُعتَمَدُ
وَلا سَليلٌ يَسُرُّهُ تَلفي
كَناضِحٍ في رِضايَ يَجتَهِدُ
ذا يَتَمَنّى فَقدي لِكَي يَجدَ ال
مالَ وَهَذا لِحُزنِهِ يَجِدُ
رَبيبُ بَيتي بَل رَبُّ نِعمَتِهِ
وَمَن بِهِ في الأُمورِ أَعتَضِدُ
يَسعى لِنَفعي بِالطَبعِ مِنهُ وَلا
يَقصُرُ في فِعلِهِ وَيَضطَهِدُ
قَد يَقطَعُ الصارِمُ المُهَنَّدُ بِال
طَبعِ وَيَمضي بِرُغمِهِ الوَتَدُ
وَهوَ القَويُّ الأَمينُ إِن عَرَضَت
لي أَزمَةٌ كانَ مِنهُ لي مَدَدُ
مَنظَرُهُ صالِحٌ وَمَخبَرُهُ
فَالبَدرُ في بُردَتَيهِ وَالأَسَدُ
كانَ لِساناً لي ناطِقاً وَيَداً
طُولى وَظَهراً إِلَيهِ أَستَنِدُ
لَم تَكُ لي دارُ مَيَّةٍ غَرَضاً
إِذ لِيَ مِنهُ العَلياءُ وَالسَنَدُ
كَفَلتُهُ يافِعاً فَكُنتُ لَهُ
كَالوالِدِ البِرِّ وَهوَ لي وَلَدُ
مُعتَقِداً فيهِ ما تَحَقَّقَ لي
مِن وُدِّهِ وَهوَ فِيَّ مُعتَقِدُ
فَقَدتُهُ فَاِرتَضَيتُ هِمَّتَهُ
وَالناسُ مِثلُ النُضارِ تُنتَقَدُ
وَظَلتُ أَغذوهُ بِالعُلومِ وَما
يَزينُهُ وَهوَ فيهِ مُجتَهِدُ
فَجاءَ مُستَعذَبَ الخَلائِقِ وَال
لَفظِ وَمِصباحُ فَهمِهِ يَقِدُ
مُهَذَّبُ اللَفظِ ما بِمَنطِقِهِ
زَيغٌ وَلا في خِلالِهِ أَوَدُ
يُعرِبُ أَلفاظَهُ فَيَنفُثُ في
سِحرِ المَعاني وَما بِها عُقدُ
إِن خَطَّ طَرساً فَالدُرَّ مُنتَظِمٌ
أَو قالَ لَفظاً فَجَوهَرٌ بَدَدُ
لِلَّهِ قَلبٌ رَثَّت عَلائِقُهُ
بِهِ وَأَثوابُ حُزنِهِ جُدَدُ
قَطَعتُ مِن غَيرِهِ الرَجاءَ فَما
وَجَدتُ مِثلاً لَهُ وَلا أَجِدُ
"
259,صفي الدين الحلي,أصفيح ماء أديم أم سماء,"
أَصَفيحُ ماءٍ أَديمُ أَم سَماءِ
فيهِ تَغورُ كَواكِبُ الجَوزاءِ
ما كُنتُ أَعلَمُ قَبلَ مَوتِكَ موقِناً
أَنَّ البُدورَ غُروبُها في الماءِ
وَلَقَد عَجِبتُ وَقَد هَوَيتَ بِلُجَّةٍ
فَجَرى عَلى رُسلٍ بِغَيرِ حَياءِ
لَو لَم يُشَقُّ لَكَ العُبابُ وَطالَما
أَشبَهتَ مَوسى بِاليَدِ البَيضاءِ
أَنِفَ العَلاءُ عَليكَ مِن لَمسِ الثَرى
وَحُلولِ باطِنِ حُفرَةٍ ظَلماءِ
وَأَجَلَّ جِسمَكَ أَن يُغَيِّرَ لُطفَه
عَفَنُ الثَرى وَتَكاثُفُ الأَرجاءِ
فَأَحَلَّهُ جَدَثاً طَهوراً مُشبِهاً
أَخلاقَهُ في رِقَّةٍ وَصَفاءِ
ما ذاكَ بِدَعاً أَن يَضُمَّ صَفاؤُهُ
نوراً يُضَنُّ بِهِ عَلى الغَبراءِ
فَالبَحرُ أَولى في القِياسِ مِنَ الثَرى
بِجِوارِ تِلكَ الدُرَّةِ الغَرّاءِ
يا مالِكي إِنّي عَلَيكَ مُتَيَّمٌ
يا صَخرُ إِنّي فيكَ كَالخَنساءِ
وَلَقَد أَلوذُ بِكَنزِ صَبري طالِباً
حُسنَ العَزاءِ وَلاتَ حَينَ عَزاءِ
وَأَعافُ شُربَ الماءِ يَطفَحُ لُجُّهُ
فَأَصُدُّ عَنهُ وَأَنثَني بِظَماءِ
وَإِذا رَأَيتُ مَدامِعي مُبيَضَّةً
مِثلَ المِياهِ مَزَجتُها بِدِماءِ
لا يُطمِعِ العُذّالَ حُسنُ تَجَلُّدي
فَلِذاكَ خَوفَ شَماتَةِ الأَعداءِ
فَلَئِن خَفَضتُ لَهُم جَناحَ تَحَمُّلي
فَالقَلبُ مَنصوبٌ عَلى الإِغراءِ
"
260,صفي الدين الحلي,لو أفادتنا العزائم حالا,"
لَو أَفادَتنا العَزائِمُ حالا
لَم نَجِد حُسنَ العَزاءِ مَحالا
كَيفَ يولي العَزمُ صَبراً جَميلاً
حينَ وارى التُربُ ذاكَ الجَمالا
ما ظَنَنّا أَنَّ ريحَ المَنايا
تَنسِفُ الطودَ وَتُردي الجِبالا
جارَ صَرفُ الدَهرِ فينا بِعَدلٍ
لَم نَجِد لِلقَولِ فيهِ مُؤالا
أَفَما تَنفَكُّ أَيدي المَنايا
تَسلُبُ المالَ وَتُفني الرِجالا
فَإِذا أَبدى لَها المَرءُ سِلماً
جَرَّدَت عَضباً وَراشَت نِبالا
كُلَّما رُمنا نُمُوّ هِلالٍ
غَيَّبَت بَدراً أَصابَ الكَمالا
فَإِذا ما قُلتُ قَد زالَ حُزنٌ
أَبدَلَت أَحداثُها اللامَ دالا
كَيفَ دَكَّت طودَ حِلمٍ نَداهُ
سَبَقَ الوَعدَ وَأَفنى السُؤالا
كَيفَ كَفَّ الدَهرُ كَفّاً كَريماً
لِيَمينِ الدَهرِ كانَت شِمالا
ثَمِلٌ مِن نَشوَةِ الجودِ أَضحى
لِليَتامى وَالأَيامى ثِمالا
نِعَمٌ لِسائِليهِ جَوابٌ
لَم يَصِل يَوماً إِلى لَن وَلا لا
دَوحَةٌ مِن عِرقِ آلِ وِشاحٍ
قَد دَنَت لِلطالِبينَ مَنالا
قَد رَسَت أَصلاً وَطابَت ثِماراً
وَزَكَت فَرعاً وَمَدَّت ظِلالا
أَزعَجَ النادي بِنَجواهُ ناعٍ
كَم نُفوسٍ في دُموعٍ أَسالا
فَسَمِعنا مِنهُ نَدباً لِنَدبٍ
أَبعَدَ الصَبرَ وَأَدنى الخَيالا
باتَ يُهدِ لِلقُلوبِ اِشتِغالا
وَلِنيرانِ الهُمومِ اِشتِعالا
قَد مَرَرنا في مَغانيهِ رَكباً
وَغَوادي الدَمعِ تَجري اِنهِمالا
وَسَأَلنا النارَ عَنهُ فَقالَت
كانَ تاجُ الدينِ رُكناً فَزالا
كانَ وَبلاً لِلعُفاةِ هَتوناً
وَلِأَحزابِ العُداةِ وَبالا
كانَ تاجُ الدينِ لِلدَهرِ تاجاً
زادَ هامُ الدَهرِ مِنهُ جَمالا
كانَ زِلزالاً لِباغٍ عَصاهُ
وَلِباغِ الرِفدِ مِنهُ زُلالا
كانَ لِلأَعداءِ ذُلّاً وَبُؤساً
وَلِراجِ الجودِ عِزّاً وَمالا
كانَ لِلناسِ جَميعاً كَفيلاً
فَكَأَنَّ الخَلقَ كانوا عِيالا
راعَ أَحزابَ العِدى بِيَراعٍ
طالَما أَنشى السَحابَ الثِقالا
ناحِلِ الجِسمِ قَصيرٍ دَقيقٍ
دَقَّ في الحَربِ الرِماحَ الطِوالا
يَجعَلُ النَومَ عَلَيهِم حَراماً
كُلَّما أَبرَزَ سِحراً حَلالا
فَإِذاما خَطَّ أَسوَدَ نَقشٍ
خِلتَهُ في وَجنَةِ الدَهرِ خالا
يا كَريماً طابَ أَصلاً وَفَرعاً
وَسَما أُمّاً وَعَمّاً وَخالا
وَخَليلاً مُذ شَرِبتُ وَفاهُ
لَم أَرِد نَبعاً بِهِ أَو خِلالا
وَإِذا ما فُهتُ بِاِسمِ أَبيهِ
كانَ لِلميثاقِ وِالعَهدِ فالا
إِن أَسَأنا لَم يَرُعنا بِلَومٍ
وَإِذا لُمناهُ أَبدى اِحتِمالا
كانَ عَصرُ الأُنسِ مِنكَ رُقاداً
وَلَذيذُ العَيشِ فيهِ خَيالا
مَن لَدَستِ الحُكمِ بَعدَكَ قاضٍ
لَم يَمِل يَوماً إِذا الدَهرُ مالا
مَن لِإِصلاحِ الرَعايا إِذا ما
أَفسَدَت مِنها يَدُ الدَهرِ حالا
مَن لِإِطفاءِ الحُروبِ إِذا ما
صارَ آلُ المَرءِ بِالكَرِّ آلا
وَإِذا صارَ الجِدالُ جِلاداً
أَخمَدَ الحَربَ وَأَفنى الجِدالا
رُبَّ يَومٍ مَعرَكُ الحَربِ فيهِ
حَطَّمَ السَمرَ وَفَلَّ النِصالا
ذَكَرَ الأَحقادَ فيهِ رِجالٌ
حَبَّبَ الطَعنُ إِلَيها النِزالا
في مَكَرٍّ واسِعِ الهَولِ ضَنكٍ
لا يُطيقُ الطِرفُ فيهِ مَجالا
أَلبَسَ الجَوَّ العَجاجُ لِثاماً
وَكَسا الخَيلَ الغُبارُ جِلالا
شِمتُ في إِصلاحِهِم غَضبَ عَزمٍ
زادَهُ حَزمُ الأُمورِ صِقالا
بِكَ كَفَّ اللَهُ كَفَّ الرَزايا
وَكَفى اللَهُ الأَنامَ القِتالا
فَلَئِن وارَتكَ أَرضٌ فَها قَد
سارَ مِنكَ الذِكرُ فيها وَجالا
لَم يَمُت مَن طابَ ذِكراً وَأَبقى
بَعدَهُ شِبهاً لَهُ أَو مِثالا
أَسَدٌ خَلَّفَ شِبلَي عَرينٍ
شَيَّدا مَجداً لَهُ لَن يُنالا
ظَلَّ زَينُ الدينِ لِلدَهرِ زَيناً
وَجَمالُ الدينِ فيهِ جَمالا
فَأَرانا اللَهُ أَقصى الأَماني
فيهِما إِن جارَ دَهرٌ وَمالا
وَحَباكَ اللَهُ في الخُلدِ رَوحاً
وَنَعيماً خالِداً لَن يُزالا
"
