,poet_name,poem_name,poem_content
80,صفي الدين الحلي,نم بسر الروض خفق الرياح,"
نَمَّ بِسِرِّ الرَوضِ خَفقُ الرِياح
وَاِقتَدَحَ الشَرقُ زِنادَ الصَباح
وَأَخجَلَ الوَردُ شُعاعَ الضُحى
فَاِبتَسَمَت مِنهُ ثُغورُ الأَقاح
وَقامَ في الدَوحِ لَنَعيِ الدُجى
حَمائِمٌ تُطرِبُنا بِالصِياح
مُذ وُلِدَ الصُبحُ وَماتَ الدُجى
صاحَت فَلَم نَدرِ غِناً أَم نُواح
وَيَومَ دَجنٍ حُجِبَت شَمسُهُ
وَأَشرَقَت في لَيلِهِ شَمسُ راح
فَما ظَنَنّا الصُبحَ إِلّا دُجىً
وَلا حَسِبنا اللَيلَ إِلّا صَباح
وَقابَلَت نورَ الضُحى أَوجُهٌ
لِلغيدِ تَبغي في الصَباحِ اِصطِباح
فَظَلتُ ذا النورَينِ في مَجلِسي
مِن وَجهِ صُبحٍ وَوُجوهٍ صِباح
وَشادِنٍ إِن جالَ ماءُ الحَيا
في مُقلَتَيهِ زادَهُنَّ اِتِّقاح
يُسكِرُنا مِن خَمرِ أَلحاظِهِ
وَيَمزُجُ الجِدَّ لَنا بِالمُزاح
مِن لَحظِهِ يَسقي وَمِن لَفظِهِ
وَريقِهِ خَمراً حَلالاً مُباح
نَواظِرٌ تُعزى إِلَيها الظُبى
وَقامَةٌ تُعزى إِلَيها الرِماح
يا عاذِلي في حُسنِ أَوصافِهِ
وَمُسمِعي وَصفَ الفَتاةِ الرَداح
في حُبِّ ذي القُرطَينِ يا لائِمي
لي شاغِلٌ عَن حُبِّ ذاتِ الوِشاح
دَعني أُقَضّي العَيشَ في غِبطَةٍ
مُتَّبِعاً مَغدى الهَوى وَالمَراح
مِن قَبلِ أَن يَهتِفَ داعِ النَوى
فَلَم أَجِد عَن بَينِنا مِن بَراح
فَكُلَّ يَومٍ لي بِرُغمِ العُلى
في كُلِّ أَرضٍ غُربَةٌ وَاِنتِزاح
واضيعَةَ العُمرِ وَفَوتَ المُنى
بَينَ رِضى الكومِ وَسُخطِ المِلاح
وَرُبَّ لَيلٍ خُضتُ تَيّارَهُ
بِأَدهَمٍ يَسبُقُ جَريَ الرِياح
مُحَجَّلِ الأَربَعِ ذي غُرَّةٍ
مَيمونَةِ الطَلعَةِ ذاتِ اِتِّضاح
كَأَنَّهُ قَد شَقَّ بَحرَ الدُجى
وَبَعدَهُ خاضَ غَديرَ الصَباح
لَم تَعلَمِ الأَبصارُ في جَريِهِ
قادِمَةً خَفَّت بِهِ أَم جَناح
يَقرَأُ مِن وَحيِ ضَميري لَهُ
تَقاعُساً رُمتُ بِهِ أَم جِماح
مُذ فَسُدَ العَيشُ رَأى قَصدَهُ
لِلمَلِكِ الصالِحِ عَينَ الصَلاح
المَلِكُ النَدبُ الَّذي شُكرُهُ
صارَ اِعتِباراً لِلوَرى وَاِصطِلاح
مُمَنَّعُ المَجدِ رَفيعُ العُلى
لَم يَكُ إِلّا مالُهُ مُستَباح
يَكادُ مِن دِقَّةِ أَفكارِهِ
يُزري بِما يُجري القَضاءُ المُتاح
لَهُ يَدٌ إِن جادَ كانَت حَياً
وَهِمَّةٌ إِن جالَ كانَت سِلاح
وَرَحبُ صَدرٍ كُلَّما هيمَنَت
فيهِ نَسيمُ المَدحِ زادَ اِرتِياح
يا حامِلَ الأَثقالِ مِن بَعدِما
حَطَّ مِراراً غَيرُهُ وَاِستَراح
لَولاكَ يا وابِلُ زَرعُ النَدى
أَضحى هَشيماً وَذَرَتهُ الرِياح
يا اِبنَ الَّذي حَجَّ إِلَيهِ الوَرى
لِكونِهِ كَعبَةَ دينِ السَماح
إِن قَصُرَت مِنّي إِلَيكَ الخُطى
ما قَصُرَت مِنّي يَدُ الإِمتِداح
فَقَد جَعَلتُ الأَرضَ مِن مَدحِكُم
خَضرا وَشِعري جائِلٌ كَالوِشاح
خَفَضتُ بِالنَصبِ اِستِعاراتِهِ
كَما أُعيرَ الذُلُّ خَفضَ الجَناح
إِذا تَلاهُ الوُفدُ قالَ الوَرى
هَذا هُوَ السِحرُ الحَلالُ المُباح
ذِكرُكَ كَالمِسكِ وَلَكِنَّهُ
إِن ضَوَّعَتهُ نَسمَةُ المَدحِ فاح
"
81,صفي الدين الحلي,إني ليطربني العذول فأنثني,"
إِنّي لَيُطرِبُني العَذولُ فَأَنثَني
فَيَظُنُّ أَنّي عَن هَواكُمُ أَنثَني
وَيَلَذُّ لي تَذكارُكُم فَأُعيرُ
أُذناً لِغَيرِ حَديثِكُم لَم تَأذَنِ
وَأَقولُ لِلّاحي المُلِحُّ بِذِكرِكُمُ
زِدني لَعَمرُ أَبيكَ قَد أَطَرَبتَني
أَسكَرتَني بِسُلافِ ذِكرِ أَحِبَّتي
يا مُترِعَ الكاساتِ فَاِملَأ وَاِسقِني
يا ساكِني جَيرونَ جُرتُم في الهَوى
وَالجَورُ شَرُّ خَلائِقِ المَتَمَكِّنِ
وَسَمِعتُمُ قَولَ الوُشاةِ وَإِنَّهُ
ظَنٌّ رُميتُ بِهِ بَغَيرِ تَيَقُّنِ
أَيَسومُ إِشراكي بَدينِ هَواكُمُ
مَن لَيسَ في شَرعِ الغَرامِ بِمُؤمِنِ
يا عاذِلي إِن كُنتَ تَجهَلُ ما الهَوى
فَاِنظُر ظِباءَ التُركِ كَيفَ تَرَكنَني
وَاِعجَب لِأَعيُنِهِنَّ كَيفَ أَسَرنَني
مِن مَعشَري وَأَخَذنَني مِن مَأمَني
بيضُ الطُلى سُمرُ القُدودِ نَواصِعُ ال
وَجَناتِ حُمرُ الحَليِ سودُ الأَعيُنِ
مِن كُلِّ فاضِحَةِ الجَبينِ كَأَنَّها
شَمسُ النَهارِ بَدَت بِلَيلٍ أَدكَنِ
يَسمو لَها كُحلٌ بِغَيرِ تَكَحُّلِ
وَيُزينُها حُسنٌ بِغَيرِ تَحَسُّنِ
وَمُضَعَّفُ الأَجفانِ فَوَّقَ لَحظَهُ
نَبلاً عَلى بُعدِ المَدى لَم يُخطِني
إِن قُلتُ مِلتَ عَلى المُتَيَّمِ قالَ لي
أَرأَيتَ غُصناً لا يَميلُ وَيَنثَني
أَو قُلتُ أَتلَفتَ الفُؤادَ أَجابَني
دَعني فَما أَخرَبتُ إِلّا مَسكَني
أَو قُلتُ يا دُنيايَ قالَ فَإِن أَكُن
دُنياكَ لِم أَنكَرتَ فَرطَ تَلَوَّني
لَم أَنسَ إِذ نادَمتُهُ في لَيلَةٍ
عَدَلَ الزَمانُ بِمِثلِها لَم يَمنُنِ
وَالراحُ تُبذَلُ في الكُؤوسِ كَأَنَّها
لَفظٌ تَلَجلَجَ مِن لِسانٍ أَلكَنِ
حَتّى إِذا ما السُكرُ ثَقَّلَ عِطفَهُ
كَسَلاً وَسَكَنَ مِنهُ مالَم يَسكُنِ
عاجَلتُهُ حَذَراً عَليهِ مِنَ الرَدى
عَجَلَ الجُفونِ إِلى حِفاظِ الأَعيُنِ
وَضَمَمتُهُ مِن غَيرِ مَوضِعِ ريبَةٍ
وَأَطَعتُ فيهِ تَعَفُّفي وَتَدَيُّني
نَحنُ الَّذينَ أَتى الكِتابُ مُخَبِّراً
بِعَفافِ أَنفُسِنا وَفِسقِ الأَلسُنِ
وَكَذَاكَ لا أَنفَكُّ أُلقِيَ مِقوَدي
طَوعَ الهَوى وَأَعَفُّ عِندَ تَمَكُّني
فَإِذا أَقَمتُ جَعَلتُ أَبناءَ العُلى
سَكَني وَأَبنِيَةَ المَعالي مَسكَني
وَإِذا رَحَلتُ فَجِنَّتي أَجَمُّ القَنا
وَعَلى مُتونِ الصافِناتِ تَحَصُّني
وَلَكَم أَلِفتُ الإِغتِرابَ فَلَم يَزَل
جودُ اِبنِ أُرتُقَ في التَغَرُّبِ مَوطِني
الصالِحُ المَلِكُ الَّذي إِنعامُهُ
كَنزُ الفَقيرِ وَطَوقُ جيدِ المُغتَني
مَلِكٌ يُريكَ إِذا خَطَبتَ سَماحَهُ
عُذرَ المُسيءِ وُجودَ كَفِّ المُحسِنِ
مُتَأَلِّقٌ مُتَدَفِّقٌ مُتَرَفِّقٌ
لِلمُجتَلي وَالمُجتَدي وَالمُجتَني
بِفَضائِلٍ وَفَواضِلٍ وَشَمائِلٍ
قَيدُ الخَوَطِرِ وَالثَنا وَالأَعيُنِ
فَإِذا تَبَدّى كانَ قَيدَ عُيونِنا
وَإِذا تَلَفَّظَ كانَ قَيدَ الأَلسُنِ
يُرجى وَيَخشى جودُهُ وَنِكالُهُ
في يَومِ مَكرُمَةٍ وَخَطبٍ مُزمِنِ
كَالبَحرِ يَرغَبُ في جَواهِرِ لُجِّهِ
عِندَ الوُرودِ وَهَولُهُ لَم يُؤمَنِ
يا طالِباً مِنّا حُدودَ صِفاتِهِ
أَتعَبتَنا بِطَلابِ ما لَم يُمكِنِ
يَأَيُّها المَلِكُ الَّذي في حَربِهِ
بِالعَزمِ عَن حَدِّ الصَوارِمِ يَغتَني
لَو أَنَّ رَأيَكَ لِلدُجُنَّةِ لَم تَحُل
صِبغاً وَلِلحِرباءِ لَم تَتَلَوُّنِ
فَإِذا هَزَزتَ الرُمحَ نَكَّسَ رَأسَهُ
وَأَجابَ ها إِنّي كَما عَوَّدتَني
وَإِذا سَأَلتَ السَيفَ قالَ فِرِندُهُ
لا عِلمَ لي إِلّا الَّذي عَلَّمتَني
هَذي يَمينُكَ وَالوَغى وَمَضارِبِي
وَدَمُ الفَوارِسِ وَالظَما بِيَ فَاسقَني
يا مَن رَماني عَن قِسيِّ سَماحِهِ
بِسِهامِ أَنعُمِهِ الَّتي لَم تُخطِني
أَغرَقتَني بِالجودِ مَع سَأَمي لَهُ
رَدّاً عَلَيَّ فَكَيفَ لَو قُلتُ اِعطِني
يَعتَادُني بِالشامِ بِرُّكَ واصِلاً
طَوراً وَطوراً في بِلادِ الأَرمَن
وَيَزورُني في غَيبَتي وَيَحوطُني
في أَوبَتي وَيَعودُني في مَوطِني
أَتعَبتَني بِالشُكرِ أَعجَزَ طاقَتي
وَظَنَنتَ أَنَّكَ بِالنَوالِ أَرَحتَني
أَخفَيتَ بِرَّكَ لي فَأَعلَنَ مَنطِقي
لا يَشكُرُ النَعماءَ مَن لَم يُعلِنِ
شَهِدَت عُلومُكَ أَنَّني لَكَ وامِقٌ
وَاللَهُ يَعلَمُ وَالأَنامُ بِأَنَّني
وَعَرَفتُ رَأيَكَ بي فَلَو كُشِفَ الغَطا
عَن حالَةٍ ما اِزدادَ فيكَ تَيَقُّني
عَوَّدتَني صَفوَ الوِدادِ فَعُد بِهِ
وَاِصبِر لِعادَتِكَ الَّتي عَوَّدتَني
وَاِعذِر مُحِبّاً حُبُّهُ لِعُلاكُمُ
طَبعٌ وَصَفوُ وِدادِهِ مِن مَعدِنِ
يَدعو لِدَولَتِكَ الشَريفَةِ مُخلِصاً
وَالناسُ بَينَ مُؤَمِّلٍ وَمُؤَمِّنِ
"
82,صفي الدين الحلي,خذ فرصة اللذات قبل فواتها,"
خُذ فُرصَةَ اللَذّاتِ قَبلَ فَواتِها
وَإِذا دَعَتكَ إِلى المُدامِ فَواتِها
وَإِذا ذَكَرتَ التائِبينَ عَنِ الطِلا
لا تَنسَ حَسرَتَهُم عَلى أَوقاتِها
يَرنونَ بِالأَلحاظِ شَزراً كُلَّما
صَبَغَت أَشِعَّتُها أَكُفَّ سُقاتِها
كَأسٌ كَساها النورُ لَمّا أَن بَدا
مِصباحُ جِرمِ الراحِ في مِشكاتِها
صِفها إِذا جُليَت بِأَحسَنِ وَصفِها
كَي نُشرِكَ الأَسماعَ في لَذّاتِها
لَولا اِلتِذاذُ السامِعينَ بِذِكرِها
لَغَنيتَ عَن أَسمائِها بِسِماتِها
وَإِذا سَمِعتَ بَأَنَّ قِدماً مُظهِراً
عَنها النَفارَ فَتِلكَ مِن آياتِها
ذَنبٌ إِذا عُدَّ الذُنوبُ رَأَيتُهُ
مِن حُسنِهِ كَالخالِ في وَجَناتِها
راحٌ حَكَت ثَغرَ الحَبيبِ وَخَدَّه
بِحَبابِها وَصَفائِها وَصِفاتِها
فَكَأَنَّما في الكاسِ قابِلَ صَفوُها
ثَغرَ الحَبيبِ وَلاحَ في مِرآتِها
وَلَئِن نَهى عَنها المَشيبُ فَطالَما
نَشَأَت لِيَ الأَفراحُ مِن نَشَواتِها
وَالقُضبُ دانِيَةٌ عَلَيَّ ظِلالُها
وَالزَهرُ تاجاتٌ عَلى هامَتِها
وَالماءُ يُخفي في التَدَفُّقِ صَوتَهُ
وَالوُرقُ تَسجَعُ بِاِختِلافِ لُغاتِها
وَلَقَد تَرَكتُ وِصالَها عَن قُدرَةٍ
وَزَجَرتُ داعي النَفسِ عَن شُبُهاتِها
لَم أَشكُ جَورَ الحادِثاتِ وَلَم أَقُل
حالَت بِيَ الأَيّامُ عَن حالاتِها
ما لي أَعُدُّ لَها مَساوِىءَ جَمَّةً
وَالصالِحُ السُلطانُ مِن حَسَناتِها
رَبُّ العَفافِ المَحضِ وَالنَفسِ الَّتي
غَلَبَت مُروءَتُها عَلى شَهَواتِها
مَلَكِيَّةً فَلَكِيَّةٌ يَسمو بِها
كَرَمٌ تَرَنَّحَ كُنهُهُ في ذاتِها
تَحتالُ في العُذرِ الجَميلِ لِوَفدِها
كَرَماً وَلَكِن بَعدَ بَذلِ هِباتِها
سَبَقَت مَواهِبُهُ السُؤالَ فَما لَهُ
عِدَةٌ مُؤَجَّلَةٌ إِلى ميقاتِها
مَلِكٌ تُقِرُّ لَهُ المُلوكُ بِأَنَّهُ
إِنسانُ أَعيُنِها وَعَينُ حَياتِها
لَو لَم يَنُط بِالبِشرِ هَيبَةَ وَجهِهِ
ذَهَلَت بَنو الأَمالِ عَن حاجاتِها
يُعطي الأُلوفَ لِوافِديهِ بِراحَةٍ
نَثني يَدَ الأَيّامِ عَن سَطواتِها
فَكَأَنَّما قَتَلَ الحَوادِثَ دونَها
وَغَدا يُؤَدّي لِلعُفاةِ دِياتِها
مِن فِتيَةٍ راضَ الوَقارُ نُفوسَها
فَبَدا سُكونُ الحِلمِ في حَرَكاتِها
لَو أَمَّها يَومَ القِيامَةِ طالِبٌ
نَقَلَت إِلى ميزانِهِ حَسَناتِها
في كَفِّهِ القَلَمُ الَّذي خَضَعَت لَهُ
بيضُ الصَفاحِ وَفُلُّ حَدُّ شَباتِها
وَسَطا عَلى الأَرماحِ وَهوَ رَبيبُها
وَأَليفُها في الغابِ عِندَ نَباتِها
قَلَمٌ فَرى كَبِدَ الأُسودِ وَما رَعى
حَقَّ الجِوارِ لَهُنَّ في أَجَماتِها
ما شاهَدَ الأَملاكُ مَجَّةَ ريقِهِ
إِلّا وَجَفَّ الريقُ في لَهَواتِها
يا أَيُّها المَلِكُ الَّذي سَطَواتُهُ
حَلِمَت بِها الأَعداءُ في يَقظاتِها
إِن كُنتَ مِن بَعضِ الأَنامِ فَإِنَّما
غُرَرُ الجِيادِ تُعَدُّ بَعضُ شِياتِها
شَهِدَت لِراحَتِكَ السَحائِبُ أَنَّها
رَيُّ البَسيطَةِ وَهيَ مِن ضَرّاتِها
فَالناسُ تَدعوها مَفاتِحَ رِزقِها
وَتَعُدُّها الأَموالُ مِن آفاتِها
شَتَّتَّ شَملَ المالِ بَعدَ وُفورِهِ
وَجَمَعتَ شَملَ الناسِ بَعدَ شَتاتِها
فَظَهَرتَ بِالعَدلِ الَّذي أَمسى بِهِ
في البيدِ يَخشى ذَيبُها مِن شاتِها
تُبدي اِبتِساماً لِلعُداةِ وَراءَهُ
رَأيٌ يُنَكَّسُ في الوَغى راياتِها
كَالسُمرِ تُبدي لِلنَواظِرِ مَنظَراً
مُتَأَلِّقاً وَالمَوتُ في شَفَراتِها
وَكَتيبَةٍ تَختالُ في أَجمِ القَنا
كَالأُسدِ تَسري وَهيَ في غاباتِها
سِيّانِ ما تَحوي السُروجُ وَما حَوَت
أَيدي الفَوارِسِ مِن سَريحِيّاتِها
أَرسَلتَ فيها لِلرِماحِ أَراقِماً
لَسَبَت قُلوبَ حُماتِها بِحُماتِها
جَشَّمتَها جُرداً إِذا رُمتَ العُلى
أَرسَلتَها فَجَرَت إِلى غاياتِها
ما بَينَ عَينَيها الأَسِنَّةُ طُلِّعٌ
فَكَأَنَّها غُرَرٌ عَلى جَبَهاتِها
سَدَّت حَوافِرُها الفَضاءَ بِعَثيَرٍ
غَنِيَت بِهِ العِقبانُ عَن وُكُناتِها
صافَحتَ هاماتِ العِدى بِصَفائِحٍ
دَبَّت نِمالُ المَوتِ في صَفَحاتِها
حَتّى أَعَدتَ بِها الجِيادَ وَشُهبُها
حُمرٌ لِوَخزِ السُمرِ في لَبّاتِها
وَجَعَلتَ أَشلاءَ الكُماةِ كَأَنَّما
ذَخَرَت لِقوتِ الوَحشِ في فَلَواتِها
ضَمِنَت بِها قوتَ الوُحوشِ فَأَصبَحَت
عِندَ العَريكَةِ وَهيَ مِن أَقواتِها
يا حامِلَ الأَثقالِ وَهيَ شَدائِدٌ
وَالخائِضَ الأَهوالِ مِن غَمَراتِها
وَمُفَرِّجَ الكُرَبِ الَّتي لَو صافَحَت
شُمَّ الجِبالِ لزَلزَلَت هَضباتِها
قَد كادَ يُغرِقُ بَحرُ نائِلِكَ الوَرى
فَجَعَلتَ سِرَّ الجودِ سُفنَ نَجاتِها
فَاِسعَد بِعيدٍ أَنتُمُ عيدٌ لَهُ
وَمَواسِمٍ بِكُمُ هَنا ميقاتِها
فِطرٌ فَطَرتَ بِيُمنِهِ كَبِدَ العِدى
فَشَغَلتَ أَنفُسَها بِها عَن ذاتِها
وَوَصَلتَ فيهِ العاكِفينَ عَلى التُقى
فَشَرِكتَها في صَومِها وَصَلاتِها
فَاِستَجلِها مِن حورِ حِلَّةِ بابِلٍ
فَلِذاكَ تُبدي السِحرَ مِن نَفَثاتِها
ظَمآنَةٌ لِلقاكَ وَهيَ رَوِيَّةٌ
بِبِدائِعٍ تَروي غَليلَ رُواتِها
لا تَبتَغي مَهراً سِوى إِجرائِها
مِن قُربِ حَضرَتِكُم عَلى عاداتِها
تَستَنجِزُ الوَعدَ الشَريفَ لِرَيِّها
لِتَروعَ قَلبَ عُداتِها بِعِداتِها
هَذي كُنوزُ الشُكرِ وافِرَةٌ لَكُم
فَاِجعَل نَجازَ الوَعدِ بَعضَ زَكاتِها
"
83,صفي الدين الحلي,أيا ملك العصر الذي شاع فضله,"
أَيا مَلِكَ العَصرِ الَّذي شاعَ فَضلُهُ
وَيا اِبنَ مُلوكِ العُربِ وَالعُجمِ وَالتُركِ
وَمَن عَلَّمَتني المَدحَ أَو صافُ مَجدِهِ
فَما زِدتُها عِندَ النِظامِ سِوى السَلكِ
لَقَد غَمَرَتني مِن أَياديكَ أَنعُمٌ
مَلَكتَ بِها رِقّي وَإِن أَكثَرَت مُلكي
أُعَدُّ إِذا فارَقتُ مَغناكَ تاجِراً
فَإِن أُبتُ ظَنّوني شَريكَكَ في المُلكِ
لِذَلِكَ لَم تَثنِ الحُطوبُ مَوَدَّتي
وَلَكِنَّني مِثلُ النُضارِ عَلى السِبكِ
فَإِن يَكُ صَرفُ الدَهرِ قَد حَكَّ جانِبي
لِيَخبُرَني وَالتِبرُ يُخبَرُ بِالحَكِّ
فَقَد زِدتُ مَع وَقعِ الحَوادِثِ رَغبَةً
كَما زادَ فَرطُ السَحقِ في أَرجِ المِسكِ
فَإِن أَخطَأَتني مِن نَداكَ سَحابَةٌ
فَما غَيَّرَت حُبّي وَلا أَوجَبَت تَركي
لِأَنِّيَ مِن أَهلِ اليَقينِ عَلى الوَفا
وَقَد يَحدُثُ التَغييرُ عِندَ ذَوي الشَكِّ
"
84,صفي الدين الحلي,يا مليكا قد طاب أصلا وفرعا,"
يا مَليكاً قَد طابَ أَصلاً وَفَرعاً
وَزَكَت مِن أُصولِهِ الأَعراقُ
وَالَّذي جَمَّعَ الفَضائِلَ وَالحَم
دَ وَلِلمالَ في يَدَيهِ اِفتِراقُ
كَم تَحَمَّلتَ في طِلابِكَ لِلعَل
ياءِ ثِقلاً يَسيرُهُ لا يُطاقُ
لا تَخَف إِن أَضاعَتِ المالَ كَفّا
كَ فَفيهِنَّ لِلعَلاءِ اِتِّفاقُ
لا يَضُرُّ القَضيبَ وَهوَ نَضيرٌ
أَن تَزولَ الثَمارُ وَالأَوراقُ
"
85,صفي الدين الحلي,رعى الله ملكا ما رمتني بربعه,"
رَعى اللَهُ مَلِكاً ما رَمَتني بِرَبعِهِ
مَرامي النَوى إِلّا بَلَغتُ مَرامِيا
فَتىً رَبَّني بِالمَكرُماتِ وَبَرَّني
وَأَصلَحَ ما بَيني وَبَينَ زَمانِيا
وَكَم حاجَةٍ حاوَلتُها مِن جَنابِهِ
وَأَلحَقتُ في قَولي لَهُ وَخِطابِيا
فَلَم يَلقَ إِلحاحي بِحُبٍّ وَإِنَّما
أَجادَ التَغاضي إِذ أَسَأتُ التَقاضِيا
"
86,صفي الدين الحلي,أجرد كي أجرد سيف مدحي,"
أُجَرَّدُ كَي أُجَرَّدَ سَيفَ مَدحي
فَيَنبو عَن سِواكَ بِهِ لِساني
وَأَنظِمُ مَدحَ غَيرِكَ وَالقَوافي
تَعَضُّ عَلَيَّ أَطرافَ البَنانِ
فَأُظهِرُ حَيرَةً في بَسطِ عُذري
وَأُخفي ما يُجِنُّ لَكُمُ جَناني
فَإِن أَفعَل تَأَلَّمَتِ المَعالي
وَإِن أَنكُل تَظَلَّمَتِ المَعاني
"
87,صفي الدين الحلي,شملت جمع صحابي,"
شَمَلتَ جَمعَ صِحابي
بِفَيضِ جودٍ وَفَضلِ
فَأَنتَ شامِلُ جَمعي
وَأَنتَ جامِعُ شَملي
"
88,صفي الدين الحلي,سأثني على نعماك بالكلم ,"
سَأُثني عَلى نُعماكَ بِالكَلِمِ الَّتي
بِها تُضرَبُ الأَمثالُ في اللَفظِ وَالفَضلِ
بِها تَطرُدُ السارونَ عَن جَفنِها الكَرى
وَتَجلُبُ طيبَ النَومِ في المَهدِ لِلطِفلِ
"
89,صفي الدين الحلي,سأثني على نعماك مادمت باقيا,"
سَأُثني عَلى نُعماكَ مادُمتُ باقِياً
وَإِن مِتُّ يُثني مَنطِقُ الطِرسِ مِن بَعدي
فَقَد أَودَعَت صَدرَ الطُروسِ بَدائِعي
لِمَجدِكَ ما يَقضي لِذِكرِكَ بِالخُلدِ
"
90,صفي الدين الحلي,أطلقت نطقي بالمحامد عندما,"
أَطلَقتَ نُطقي بِالمَحامِدِ عِندَما
قَيَّدتَني بِسَوابِقِ الإِنعامِ
فَليَشكُرَنكَ نِيابَةً عَن مَنطِقي
صَدرُ الطُروسِ وَأَلسَنُ الأَقلامِ
"
91,صفي الدين الحلي,سأشكر نعماك التي لو جحدتها,"
سَأَشكُرُ نُعماكَ الَّتي لَو جَحَدتُها
أَقَرَّ بِها حالي وَنَمَّ بِها سِرّي
وَفي حُسنِ حالِ الرَوضِ أَعدَلُ شاهِدٍ
يُقِرُّ بِما أَسدَت إِلَيهِ يَدُ القَطرِ
"
92,صفي الدين الحلي,سأثني على نعماك بالكلم التي,"
سَأُثني عَلى نُعماكِ بِالكَلِمِ الَّتي
مَحاسِنُها تُبلي الزَمانَ وَلا تَبلى
وَأَشكُرُ شُكراً لَيسَ لي فيهِ مِنَّةٌ
وَلا مِنَّةٌ لِلرَوضِ إِن شَكَرَ الوَبلا
"
