,poet_name,poem_name,poem_content
525,صفي الدين الحلي,عجنا على وادي الصفا فصفا,"
عُجنا عَلى وادي الصَفا فَصَفا
عَيشي وَوَلّى الهَمُّ مُرتَحِلا
وَلَنا بِها وَالشَمسُ في أَسَدٍ
قَيظاً فَخِلنا بُرجَها الحَمَلا
في رَوضَةٍ حاكَ الرَبيعُ لَها
بُسطاً وَأَلبَسَ دَوحَها حُلَلا
ما إِن تَزالُ رِياضُها قُشُباً
أَبَداً وَبُردَةُ شَمسِها سَمِلا
فَكَأَنَّ صَوبَ المُزنِ يَعشَقُها
فَأَقامَ لا يَبغي بِها حِوَلا
ما زالَ يَبكيها وَيَعتَبُها
حَتّى تَوَرَّدَ خَدُّها خَجَلا
"
526,صفي الدين الحلي,ولم أنس إذ زار الحبيب بروضة,"
وَلَم أَنسَ إِذ زارَ الحَبيبُ بِرَوضَةٍ
وَقَد غَفَلَت عَنّا وُشاةٌ وَلُوّامُ
وَقَد فَرَشَ الوَردُ الخُدودَ وَنُشَّرَت
لِمَقدَمِهِ لِلسَوسَنِ الغَضِّ أَعلامُ
أَقولُ وَطَرفُ النَرجِسِ الغَضُّ شاخِصٌ
إِلَينا وَلِلنَمّامِ حَولِيَ إِلمامُ
أَيا رَبُّ حَتّى في الحَداقِقِ أَعيُنٍ
عَلَينا وَحَتّى في الرَياحينِ نَمّامُ
"
527,صفي الدين الحلي,ملكت ببعض برك رق شكري,"
مَلَكتَ بِبَعضِ بِرَّكَ رِقِّ شُكري
وَفَكَّ سَماحُ كَفِّكَ قَيدَ أَسري
فَإِن خَفَّفتَ بِالإِحسانِ نَهضي
فَقَدأَثقَلتَ بِالإِنعامِ ظَهري
فَما بَرِحَت صِلاتُكَ واصِلاتٍ
لِتَنجُدَني بِها وَتَشُدُّ أَزري
فَقَلبُكَ في الشَدائِدِ صَدرُ بَحرٍ
وَصَدرُكَ في الأَوابِدِ قَلبُ بَحرِ
وَكُنتُ إِذا أَتَيتُكَ بَعدَ بُعدٍ
تُصَدَّقُ فيكَ آمالي وَزَجري
يُقابِلُني نَداكَ بِبِشرِ وَجهٍ
وَيَلقاني رِضاكَ بِوَجهِ بِشرِ
فَلِم عَوَّدتَني غَيرَ اِعتِيادي
وَجَوَّزَ وَسعُ صَدرِكَ ضيقِ صَدري
عَذَرتُكَ حينَ حُلتَ وَأَنتَ بَحرٌ
لِأَنَّ البَحرَ ذو مَدٍّ وَجَزرِ
لَقَد فَكَّرتُ حَتّى حارَ فِكري
وَقَد نَقَّبتُ حَتّى عيلَ صَبري
فَلَم أَرَ مَوجِباً سُخطي وَلَكِن
لَعَلّي قَد أَسَأتُ وَلَستُ أَدري
فَإِن أَكُ قَد أَسَأتُ لَكَ التَقاضي
فَلا يَخفى عَلى مَولايَ عُذري
بِأَنّي لا يَفي بِالخَرجِ كَسبي
وَلَستُ أُضيعُ بِالتَقتيرِ عُمري
وَلَم أَكُ باذِلاً لِلناسِ وَجهي
وَلا أَنا كاسِبٌ مالاً بِشِعري
فَأَحمِلَ في التَحَمُّلِ فَوقَ طَوقي
وَأَبذُلُ في التَكَلُّفِ فَوقَ قَدري
وَأَشري عِندَكُم ماءً بِمالٍ
وَأُحرِزَ دائِماً تِبراً بِتِبري
فَأَكسَبَ كُلَّ شَهرٍ خَرجَ يَومٍ
وَأُخرِجَ كُلَّ يَومٍ كَسبَ شَهرِ
فَكَيفَ وَقَد تَوَلَّت نَقصَ كيسي
كُؤوسُ الراحِ في أَيّامِ فِطري
وَطافَ بِها ثَقيلُ الرِدفِ طَفلٌ
صَقيلُ السالِفَينِ نَحيلُ خَصرِ
بِراحٍ ذاتِ جِسمٍ مِن عَقيقٍ
ويولِدُها المِزاجُ بَناتِ دُرِّ
فَمِن لَهبٍ تَوَقَّدَ تَحتَ ماءٍ
وَمِن بَردٍ تَنَضَّدَ فَوقَ جَمرِ
أَعاقِرُ كَأسَها في كُلِّ يَومٍ
وَأُسرِفُ لَذَّتي مِن صَرفِ دَهري
وَليسَ بِشاغِلي عَن زَفِّ مَدحي
وَلَستُ أُخِلُّ في سُكري بِشُكري
"
528,صفي الدين الحلي,خدمتي في الهوى عليكم حرام,"
خِدمَتي في الهَوى عَليكُم حَرامُ
كَيفَ أَشقى بِكُم وَأَنتُم كِرامُ
إِنَّ شَرطَ الكِرامِ لا العَبدُ يَشقى
في حِماهُم وَلا النَزيلُ يُضامُ
أَنا عَبدٌ لَدَيكُمُ وَنَزيلٌ
وَلِهَذَينِ حُرمَةٌ وَذِمامُ
فَلِماذا أَضَعتُمُ عَهدَ مَن كا
نَ لَهُ صُحبَةٌ بِكُم وَاِلتِزامُ
شابَ في مَدحِكُم ذَوائِبُ شِعري
مِثلَ شَعري وَشِعرُ غَيري غُلامُ
وَنَظَمتُ البَديعَ فيكُم وَقَد أَل
قى مَقاليدَهُ إِلَيَّ الكَلامُ
فَإِذا ما تَلا الزَمانُ قَريضَي
أَصبَحَت تَستَعيدُهُ الأَيّامُ
وَتَقَرَّبتُ بِالوِدادِ فَمَحسو
دٌ مَقالي لَدَيكُمُ وَالمُقامُ
وَلَقَد ساءَني شَماتُ الأَعادي
فِيَّ لَمّا زَلَّت بِيَ الأَقدامُ
فَإِذا ما اِفتَخَرتُ بِالوُدِّ قالوا
لا اِفتِخارٌ إِلّا لِمَن لا يُضامُ
فَإِلى كَم أَعودُ في كُلِّ يَوم
خائِباً ساخِطاً وَتَرضى اللِئامُ
وَإِذا جَرَّبَ المُجَرَّبَ عَمرٌو
فَعَلَيهِ إِذا أُصيبَ المَلامُ
تَقتُلوني بِالبِشرِ مِنكُم وَقَد يَق
تُلُ مَع ضَحكِ صَفحَتَيهِ الحُسامُ
وَتُريشونَ بَينَنا أَسهُمَ البَي
نِ وَتُعزى إِلَيَّ تِلكَ السِهامُ
فَبِرُغمي فِراقُكُم وَرِضاكُم
وَشَديدٌ عَليَّ هَذا الفِطامِ
فَلَقَد صَحَّ عِندَ كُلِّ لَبيبٍ
أَنَّ بُعدي مُرادُكُم وَالسَلامُ
"
529,صفي الدين الحلي,وعودتني منك الجميل فإن يكن,"
وَعَوَّدتَني مِنكَ الجَميلَ فَإِن يَكُن
جَفاكَ لَأَمرٍ موجِبٍ فَجَميلُ
وَإِن يَكُ لي في ذاكَ ذَنبٌ فَمَنطِقي
قَصيرٌ وَإِلّا فَالعِتابُ طَويلُ
"
530,صفي الدين الحلي,جدت بخط بغير وجه,"
جُدتَ بِخَطٍّ بِغَيرِ وَجهٍ
ذاكَ حالٌ عَلَيَّ يُبطي
وَلَيسَ ذا مَذهَبي وَلَكِن
أُحِبُّ وَجهاً بِغَيرِ خَطِّ
"
531,صفي الدين الحلي,يا سادة شخصهم في ناظري أبدا,"
يا سادَةً شَخصُهُم في ناظِري أَبَداً
وَطيبُ ذِكرِهِمُ في خاطِري وَفَمي
وَمَن لَوَ اَنَّ صُروفَ الدَهرِ تُسعِدُني
لَما سَعَت نَحوَ مَغنى غَيرِهِم قَدَمي
وَاللَهِ لَو عَلِمَت روحي بِأَنَّ لَكُم
في قَتلَتي غَرَضاً آثَرتُكُم بِدَمي
"
532,صفي الدين الحلي,عذرتك إذ حالت خلائقك التي,"
عَذَرتُكَ إِذ حالَت خَلائِقُكَ الَّتي
أَطَلَّت بِها باعي وَقَصَّرتَ آمالي
لِأَنَّكَ دُنيايَ الَّتي هِيَ فِتنَتي
فَلا عَجَبٌ أَلّا تَدومَ عَلى حالِ
"
533,صفي الدين الحلي,لا والذي جعل المودة مانعي,"
لا وَالَّذي جَعَلَ المَوَدَّةَ مانِعي
مِن أَن أُجازي سَيِّدي بِجَفائِهِ
ما حَلَّتِ الأَيّامُ موثَقَ حُبِّهِ
عِندي وَلا حالَت عُهودُ وَفائِهِ
وَدَليلُ قَلبي قَلبُهُ فَوِدادُهُ
كَوِدادِهِ وَصَفاؤُهُ كَصَفائِهِ
"
534,صفي الدين الحلي,لئن سمح الزمان لنا بقرب,"
لَئِن سَمَحَ الزَمانُ لَنا بُقُربٍ
نَشَرتُ لَدَيكَ ما في طَيِّ كُتبي
وَقُمتُ مَعَ المَقالِ مَقامَ عَتبٍ
تَوَهَّمَهُ الأَنامُ مَجالَ حَربِ
أَيا مَن غابَ عَن عَيني وَلَكِن
أَقامَ مُخَيَّماً في رَبعِ قَلبي
عَهِدتُكَ زائِري مِن غَيرِ وَعدٍ
فَكَيفَ هَجَرتَني مِن غَيرِ ذَنبِ
فَإِن تَكُ راضِياً بِدَوامِ سُخطي
وَإِن تَكُ واجِداً رَوحاً بِكَربي
فَحَسبي أَنَّني بِرِضاكَ راضٍ
وَحَسبي أَن أَبيتَ وَأَنتَ حَسبي
"
535,صفي الدين الحلي,إن كنت قد غبت لا تزرني,"
إِن كُنتُ قَد غِبتُ لا تَزُرني
وَكُلَّما غِبتَ لا أَزورُ
فَإِنَّ هَذا الصُدودَ قَصدٌ
وَإِنَّ ذاكَ الوَدادَ زورُ
"
536,صفي الدين الحلي,لا يوخذ الجار في الأعراض بالجار,"
لا يوخَذُ الجارُ في الأَعراضِ بِالجارِ
إِن دامَ وَهوَ عَلى رِسلِ الوَفا جاري
عَلى ذَوي الوِدِّ بِالحُسنى بِأَنفُسِهِم
وَما عَليهِم بِفِعلِ الغَيرِ مِن عارِ
فَكَيفَ أَلحَقتُمُ فِعلَ العُداةِ بِنا
لِقُربِ دارِهِمُ بِالرُغمِ مِن داري
وَلِم عَذَقتُم بِنا ما قالَ ضِدُّكُمُ
عَنكُم وَإِن قُلتُهُ مِن غَيرِ إيثاري
كَما سَمِعتَ بِصَوتِ النارِ في حَطَبٍ
وَالصَوتُ لِلريحِ لَيسَ الصَوتُ لِلنارِ
"
537,صفي الدين الحلي,أتقتص مني إن جنى الغير زلة,"
أَتَقتَصُّ مِنّي إِن جَنى الغَيرُ زَلَّةً
كَكاسِرِ دَنِّ الخَلِّ إِن جَنَتِ الخَمرُ
وَمَن عَجَبِ الأَشياءِ أَنَّ جَريمَةً
يَجيءُ بِها زَيدٌ فَيُجزى بِها عَمرُو
"
538,صفي الدين الحلي,سعة العذر لي وضيق الحجاب,"
سَعَةُ العُذرِ لي وَضيقُ الحِجابِ
جَنَّباني عَن قَصدِ ذاكَ الجَنابِ
وَقُطوبُ الخُطوبِ أَهوَنُ عِندي
مَوقِعاً مِن تَقَطُّبِ الحُجّابِ
"
539,صفي الدين الحلي,حتام لا تضجر يا سيدي,"
حَتّامَ لا تَضجَرُ يا سَيِّدي
مِن سَعَةِ العُذرِ وَضيقِ الحِجاب
وَمَعشَرٍ إِن يَمَّموا نَحوَكُم
يَحظونَ بِالزُلفى وَحُسنِ المَآب
يا مالِكاً أَصبَحَ لي صارِماً
أُعِدُّهُ يَومَ الوَغى لِلضِراب
حاشاكَ أَن تَرضى بِقَولِ العِدى
سَيفُكَ هَذا لا يَفُكُّ القِراب
"
540,صفي الدين الحلي,رأى فرسي إسطبل موسى فقال لي,"
رَأى فَرَسي إِسطَبلَ موسى فَقالَ لي
قِفا نَبكِ مِن ذِكرى حَبيبٍ وَمَنزِلِ
بِهِ لَم أَذُق طَعمَ الشَعيرِ كَأَنَّني
بِسِقطِ اللِوى بَينَ الدُخولِ فَحَومَلِ
تُقَعقِعُ مِن بَردِ الشِتاءِ أَضالِعي
لِما نَسَجَتها مِن جَنوبٍ وَشَمأَلِ
إِذا سَمِعَ السُوّاسُ صَوتَ تَحَمحُمي
يَقولونَ لا تَهلِك أَسىً وَتَجَمُّلِ
أُعَوِّلُ في وَقتِ العَليقِ عَليهِمُ
وَهَل عِندَ رَسمٍ دارِسٍ مِن مُعَوَّلِ
"
541,صفي الدين الحلي,خدمتكم فما أبقيت جهدا,"
خَدَمتُكُمُ فَما أَبقَيتُ جُهداً
وَلا أَطمَحتُ بِالأَطماحِ طَرفي
وَجِئتُكُمُ بِمَعرِفَةٍ وَعَدلٍ
أَلَم يَكُ فيهِما مَنِعٌ لِصَرفي
"
542,صفي الدين الحلي,ولما رأينا المنع منكم سجية,"
وَلَمّا رَأَينا المَنعَ مِنكُم سَجِيَّةً
وَمازِلتُ بِالتَكليفِ مُستَفرِغاً جُهدي
عَدَلنا إِلى التَخفيفِ عَنّا وَعَنكُمُ
وَصِرنا نُجازي بِالدُعاءِ عَنِ الوِدِّ
خَلَصنا وَأَسقَطنا التَجَمُّلَ بَينَنا
فَلا سَيِّدي يُعطي وَلا عَبدُهُ يُهدي
"
543,صفي الدين الحلي,قد اطمأنت على الحرمان أنفسنا,"
قَدِ اِطمَأَنَّت عَلى الحِرمانِ أَنفُسُنا
فَلَيسَ لِلمَنعِ يَوماً عِندَنا أَثَرُ
حَتّى تَساوى لَدينا مَن لَهُ كَرَمٌ
مِنَ الأَنامِ وَمَن في نَفسِهِ قِصَرُ
يُقَصِّرونَ فَنَستَحيي وَنُعذِرُهُم
وَيَحلِفونَ فَنَستَعفي وَنَعتَذِرُ
نُهدي الثَناءَ وَلا نَبغي لَهُ ثَمَناً
وَرُبَّ دَوحٍ نَضيرٍ ما لَهُ ثَمَرُ
"
544,صفي الدين الحلي,لما رأيت بني الزمان وما,"
لَمّا رَأَيتُ بَني الزَمانِ وَما بِهِم
خِلٌّ وَفِيٌّ لِلشَدائِدِ أَصطَفي
أَيقَنتُ أَنَّ المُستَحيلَ ثَلاثَةٌ
الغولُ وَالعَنقاءُ وَالخِلُّ الوَفي
"
545,صفي الدين الحلي,ولي صاحب كهواء الخريف,"
وَلي صاحِبٌ كَهَواءِ الخَريفِ
يُضِرُّ وَإِن كانَ يُستَعذَبُ
لَهُ مَنطِقٌ كَلَيالي الشِتاءِ
طَويلٌ عَلى بَردِهِ مُسهَبُ
بَذَلتُ لَهُ خُلُقاً كَالرَبيعِ
يَطيبُ وَمَخبَرُهُ أَطيَبُ
وَإِن كانَ قَلبي بِهِ كَالمَصيَفِ
سُمومُ الهُمومِ بِهِ تَلهَبُ
"
546,صفي الدين الحلي,لله أشكو صاحبا,"
لِلَّهِ أَشكو صاحِباً
لا حُبَّ فيهِ وَلا كَرامَه
كانَ النَديمَ فَلَم أَنَل
مِن قُربِهِ غَيرَ النَدامَه
وَأَقَمتُ أَرقُبُ وَصلَهُ
فَأَقامَ في هَجري القِيامَه
قَد كانَ لي فيهِ الغَرامُ
فَصارَلي مِنهُ الغَرامَه
وَرَضيتُ مِنهُ بِالسَلا
مِ فَصِرتُ أَرضى بِالسَلامَه
فَهُناكَ قُلتُ لِخاطِري
بَعدَ المَلاةِ وَالمَلامَه
أَتَرومُ مِن بَعدِ النَدا
مَةِ مِنهُ إِدراكَ النَدى مَه
"
547,صفي الدين الحلي,وخل بغى منه قلبي الشفا,"
وَخِلٍّ بِغى مِنهُ قَلبي الشِفا
وَأَمرَضَهُ فَوقَ أَمراضِهِ
وَقُلتُ يَكونُ الصَديقُ الحَميمُ
فَجَرَّعَنيهِ بِإِعراضِهِ
"
548,صفي الدين الحلي,لدي تصح ثمار الوفاء,"
لَدَيَّ تَصِحُّ ثِمارُ الوَفاءِ
لِصَبرِيَ عِندَ اِنقِلابِ الهَوى
وَيَنبُتُ عِندي نَخيلُ الوِدادِ
لِأَنَّكَ عِندي دَفَنتَ النَوى
فَلا تَنوِ غَيرَ فِعالِ الجَميلِ
فَإِنَّ لِكُلِّ اِمرِئٍ ما نَوى
"
549,صفي الدين الحلي,كفاك تهمي بالنوال وتهمل,"
كَفاكَ تَهمي بِالنَوالِ وَتَهمُلُ
وَيَداكَ تَجزي بِالجَميلِ وَتُجزِلُ
وَعُلاكَ يَقضي لِلمُؤَمِّلِ بِالرِضى
وَعَطاكَ يَكفي الوافِدينَ وَيَكفَلُ
أَنتَ الَّذي إِن أَمَّهُ مُستَصرِخٌ
يَكمي العَطِيَّةَ لِلنَزيلِ وَيَكمُلُ
فَإِذا شَكا جَورَ الحَوادِثِ جارُهُ
يُعدي النَزيلَ عَلا الزَمانِ وَيَعدِلُ
ما كُنتَ لِلشَهباءِ إِلّا وابِلاً
يُرسى عَليها بِالقُطارِ وَيُرسَلُ
ما شاهَدَت عَينايَ قَبلَكَ حاكِماً
يُعزى إِلى فِعلِ الجَميلِ فَيُعذَلُ
مَولايَ دونَكَ نَظمَ شاكٍ شاكِرٍ
يُغضي فَيَحمي العَتبَ عَنكَ وَيَحمِلُ
وَأُجِلَّ مَجدَكَ أَن يَكونَ مُساعِدي
دَهراً فَتُبدي ضِدَّ ذاكَ وَتُبدِلُ
فَسِواكَ مَن يَرضى بِفِعلِ دَنِيَّةٍ
يَشكو الصَديقَ مِنَ المِطالِ فَيَشكُلُ
"
550,صفي الدين الحلي,طلبتم يسير المال قرضا فلم يكن,"
طَلَبتُم يَسيرَ المالِ قَرضاً فَلَم يَكُن
إِلى الرَدِّ عَمّا رُمتُموهُ سَبيلُ
وَتَعلَمُ أَنَّ المالَ في الناسِ أَخذُهُ
خَفيفٌ وَلَكِنَّ الأَداءِ ثَقيلُ
فَلا تَجعَلَنَّ العِرضَ لِلمالِ جُنَّةً
وَكُن كَالفَتى الكِنديَّ حينَ يَقولُ
يَهونُ عَلَينا أَن تُصابَ نُفُوسُنا
وَتَسلَمَ أَعراضٌ لَنا وَعُقولُ
"
551,صفي الدين الحلي,يا مهيني عند المغيب ومبد,"
يا مُهيني عِندَ المَغيبِ وَمُبدٍ
مَع حُضوري خُضوعَ عَبدٍ لِمَولى
لا تَقُم لي مَعَ التَقاعُدِ عَنّي
فَقِيامِ النُفوسِ بِالوُدِّ أَولى
"
552,صفي الدين الحلي,سأمسك عن جوابك لا لعي,"
سَأُمسِكُ عَن جَوابِكَ لا لَعَيِّ
وَرَبُّ الأَمرِ مَمنوعُ الجَوابِ
وَلَو أَنّي أَمِنتُ وَقُلتُ عَدلاً
رَأَيتُ الخَطبَ أَهوَنَ مِن خِطابي
"
553,صفي الدين الحلي,بغير ودادك لم أقنع,"
بِغَيرِ وِدادِكَ لَم أَقنَعِ
وَفي غَيرِ قُربِكَ لَم أَطمَعِ
وَأَنتَ الَّذي ما اِدَّعى فَضلَهُ
وَكَذَّبَ في وَصفِهِ المُدَّعي
وَكَم قَد هَفَوتَ بِهُجرِ الكَلامِ
فَأَعرَضتُ عَن سَمعِهِ مِسمَعي
فَكُنتَ كَأَنَّكَ ما قُلتَهُ
وَكُنتُ كَأَنِّيَ لَم أَسمَعِ
"
554,صفي الدين الحلي,رضيت ببعدي عن جنابك عندما,"
رَضيتُ بِبُعدي عَن جَنابِكَ عِندَما
رَأَيتُكَ مَطوِيَّ الضُلوعِ عَلى بُغضي
وَأَغضَيتُ لَمّا أَن رَأَيتُكَ كُلَّما
تَعَرَّضَ عَتبٌ لا تَغُضُّ وَلا يُغضي
وَأَطلَقتُ دَمعي في الخُدودِ تَأَسُّفاً
عَليكَ فَطَلَّقتُ الجُفونَ مِنَ الغُمضِ
وَأَقنَعتُ نَفسي أَن أَراكَ عَلى النَوى
بِقَلبي وَبَعضُ الشَرِّ أَهوَنُ مِن بَعضِ
"
555,صفي الدين الحلي,أراك إذا ما قلت قولا قبلته,"
أَراكَ إِذا ما قُلتَ قَولاً قَبِلتُه
وَليسَ لِأَقوالي إِلَيكَ قَبولُ
وَما ذاكَ إِلّا أَنَّ ظَنَّكَ سَيّءٌ
بِأَهلِ الوَفا وَالظَنُّ فيكَ جَميلُ
فَكُن قائِلاً قَولَ السَموأَلِ تائِهاً
بِنَفسِكَ عُجباً وَهوَ مِنكَ قَليلُ
وَنُنكِرُ إِن شِئنا عَلى الناسِ قَولَهُم
وَلا يُنكِرونَ القَولَ حينَ نَقولُ
"
556,صفي الدين الحلي,أنت ضدي إذا تيقنت قربي,"
أَنتَ ضِدّي إِذا تَيَقَّنتَ قُربي
وَالصَديقُ الشَقيقُ عِندَ فِراقي
فَلِهَذا أَصبَحتُ أَمنَحُكَ البُع
دَ وَعُذري تَعَذَّرُ الإِتِّفاقِ
مِثلُ قَولِ الشَمسِ المُنيرَةِ لِلبَد
رِ بِلَفظِ العِتابِ وَالإِشفاقِ
أَنا أَكسَبتُكَ الضِياءَ وَكَمَّل
كَ النورَ لَيلَةَ الإِشراقِ
وَإِذا ما دَنَوتَ بِالقُربِ مِنّي
نِلتُ مِنكَ الكُسوفَ حالَ التَلاقي
قالَ أَنتَ البادي لِأَنّي في بُع
دِكَ أَدنو إِلَيكَ كَالمُشتاقِ
فَإِذا ما سُرِرتُ مِنكَ بِقُربٍ
كانَ مَع ذَلِكَ السُرورِ مَحاقي
"
557,صفي الدين الحلي,حالي وحالك كالهلال وشمسه,"
حالي وَحالُكَ كَالهِلالِ وَشَمسِهِ
مُذ أَكسَبَتهُ النورَ في إِشراقِهِ
فَإِذا نَأى عَنها حَظي بِكَمالِهِ
وَإِذا دَنا مِنها رُمي بِمَحاقِهِ
"
558,صفي الدين الحلي,في طبعكم ملل مناف للوفا,"
في طَبعِكُم مَلَلٌ مُنافٍ لِلوَفا
وَمِنَ المُحالِ تَجَمُّعُ الأَضدادِ
فَإِذا تَناءَينا نَكونُ أَحِبَّةً
وَإِذا تَدانَينا نَكونُ أَعادي
فَلِذاكَ أَنّي قَد قَطَعتُ تَرَدُّدي
عَنكُم وَنارُ الشَوقِ حَشوُ فُؤادي
وَأَرَدتُ إِبقاءَ المَوَدَّةِ بَينَنا
فَرَأَيتُ صُحبَتَكُم دَوامَ بُعادي
"
559,صفي الدين الحلي,علمت بأن رأيك في التنائي,"
عَلِمتُ بِأَنَّ رَأيَكَ في التَنائي
فَلَستُ أَروعُ قَلبَكَ بِالتَداني
وَأوثِرُ أَن تَعيشَ قَريرَ عَينٍ
وَأَنّي لا أَراكَ وَلا تَراني
"
560,صفي الدين الحلي,نسيتكم لما ذكرتم مساءتي,"
نَسيتُكُمُ لَمّا ذَكَرتُم مَساءَتي
وَخالَفتُكُم لَمّا اِتَّفَقتُم عَلى هَجري
وَأَصبَحتُ لا يَجري بِبالِيَ ذِكرُكُم
مَلالاً وَلا يَجري بِبالِكُمُ ذِكري
وَقَد كُنتُ أَفنَيتُ الزَمانَ بِشُكرِكُم
وَبِالوَصفِ حَتّى شاعَ في مَدحِكُم شِعري
وَإِنّي وَإِن أَغلَظتُ في القَولِ مَرَّةً
عَليكُم لِأَمرٍ ضاقَ عَن حَملِهِ صَدري
أَمِنتُ بِما أَولَيتُ مِن حَقِّ خِدمَةٍ
إِلَيكُم وَما أَبلَيتُ مِن جِدَّةِ العُمرِ
"
561,صفي الدين الحلي,عرضنا أنفسا عزت لدينا,"
عَرَضنا أَنفُساً عَزَّت لَدينا
عَليكُم فَاِستَخَفَّ بِها الهَوانُ
وَلَو أَنّا دَفَعناها لُعَزَّت
وَلَكِن كُلُّ مَجلوبٍ مُهانُ
"
562,صفي الدين الحلي,لم يبد مني ما سيوجب وحشة,"
لَم يَبدُ مِنّي ما سَيوجِبُ وَحشَةً
وَيُبيحُ قَدرَ قَطيعَتي وَعِتابي
إِن كُنتُمُ اِستَوحَشتُمُ مِن فِعلِكُم
فَعَليكُمُ في ذاكَ دَقُّ البابِ
"
563,صفي الدين الحلي,ما زلت أعهد منك ودا صافيا,"
ما زِلتُ أَعهَدُ مِنكَ وُدّاً صافِياً
وَمَواثِقاً مَأمونَةَ الأَسبابِ
وَأَرى مَلالَكَ بَينَهُنَّ كَأَنَّهُ
حَرفٌ تَغَيَّرَ في سُطورِ كِتابِ
"
564,صفي الدين الحلي,زجرت مرور طيركم بسعد,"
زَجَرتُ مُرورَ طَيرِكُم بِسَعدٍ
فَهَلّا قَد زَجَرتَ بِذاكَ طَيري
وَما خَيَّرتَ أَينَ حَلَلتَ إِلّا
وَصَلتُ إِلَيكَ إِدلاجي بِسَيري
وَلَم يَبرَح إِلى أَعداكَ شَرّي
إِذا لا قَيتُهُم وَإِلَيكَ خَيري
وَلَم تَحفِل بِمَنزِلي وَلَكِن
سَتَذكُرُني إِذا جَرَّبتَ غَيري
"
565,صفي الدين الحلي,رعى الله قوما أصلحونا بجورهم,"
رَعى اللَهُ قَوماً أَصلَحونا بِجَورِهِم
وَعادَةُ إِصلاحِ الرَعيَّةِ بِالعَدلِ
عَرَفنا بِهِم حَزمَ الأُمورِ وَلَم نَكُن
لِنَحسِبَ حُسنَ الظَنِّ نَوعاً مِنَ الجَهلِ
فَيا مَن أَفادونا بِسوءِ صَنيعِهِم
تَجارِبَ جُرمٍ أَيقَظَت سُنَّةَ العَقلِ
عَلى رِسلِكُم في الجَورِ إِن عُدتَ ثانِياً
وَإِن بِتُّ مَغروراً بِكُم فَعَلى رِسلي
"
